{
  "$schema": "https://json-schema.org/draft/2020-12/schema",
  "$id": "https://example.org/gaam/v0.5.0/schemas/profile-manifest.schema.json",
  "title": "Profile Manifest",
  "type": "object",
  "required": [
    "id",
    "type",
    "version",
    "conformanceTargets",
    "requirements",
    "requiredArtifacts",
    "requiredEvidence",
    "requiredTests",
    "permittedExclusions",
    "dependencies"
  ],
  "properties": {
    "id": {
      "type": "string",
      "minLength": 1
    },
    "type": {
      "const": "gaam-profile-manifest"
    },
    "version": {
      "type": "string",
      "minLength": 1
    },
    "conformanceTargets": {
      "type": "array",
      "items": {
        "type": "string",
        "minLength": 1
      },
      "minItems": 1,
      "uniqueItems": true
    },
    "requirements": {
      "type": "array",
      "items": {
        "type": "string",
        "minLength": 1
      },
      "minItems": 1,
      "uniqueItems": true
    },
    "requiredArtifacts": {
      "type": "array",
      "items": {
        "type": "string",
        "minLength": 1
      },
      "minItems": 1,
      "uniqueItems": true
    },
    "requiredEvidence": {
      "type": "array",
      "items": {
        "type": "string",
        "minLength": 1
      },
      "minItems": 1,
      "uniqueItems": true
    },
    "requiredTests": {
      "type": "array",
      "items": {
        "type": "string",
        "minLength": 1
      },
      "minItems": 1,
      "uniqueItems": true
    },
    "permittedExclusions": {
      "type": "array",
      "items": {
        "type": "string",
        "minLength": 1
      }
    },
    "dependencies": {
      "type": "array",
      "items": {
        "type": "string",
        "minLength": 1
      }
    }
  },
  "additionalProperties": false
}
