{
  "id": "gaam:profile:machine-actionable-governance:0.5.0",
  "type": "gaam-profile-manifest",
  "version": "0.5.0",
  "conformanceTargets": [
    "governance-package",
    "policy-engine"
  ],
  "requirements": [
    "GAAM-POL-001",
    "GAAM-POL-002",
    "GAAM-POL-003",
    "GAAM-POL-004",
    "GAAM-POL-005",
    "GAAM-OUT-001",
    "GAAM-OUT-002",
    "GAAM-OUT-003",
    "GAAM-CONF-001",
    "GAAM-CONF-002",
    "GAAM-CONF-003",
    "GAAM-CONF-004",
    "GAAM-CONF-005",
    "GAAM-CONF-006",
    "GAAM-ART-001",
    "GAAM-ART-002",
    "GAAM-ART-003",
    "GAAM-ART-004",
    "GAAM-ART-005",
    "GAAM-ART-006",
    "GAAM-LIFE-001",
    "GAAM-LIFE-002",
    "GAAM-LIFE-003",
    "GAAM-LIFE-004",
    "GAAM-LIFE-005",
    "GAAM-DEC-004"
  ],
  "requiredArtifacts": [
    "conformance-claim",
    "validation-report",
    "gaam-package"
  ],
  "requiredEvidence": [
    "requirement-traceability",
    "test-results"
  ],
  "requiredTests": [
    "profile-completeness",
    "dependency-closure",
    "schema-validation"
  ],
  "permittedExclusions": [],
  "dependencies": [
    "gaam:profile:foundation:0.5.0"
  ]
}
