{
  "id": "gaam:profile:runtime-governance:0.9.0",
  "type": "gaam-profile-manifest",
  "version": "0.9.0",
  "conformanceTargets": [
    "runtime-enforcement-point",
    "policy-engine"
  ],
  "requirements": [
    "GAAM-OUT-001",
    "GAAM-OUT-002",
    "GAAM-OUT-003",
    "GAAM-RUN-001",
    "GAAM-RUN-002",
    "GAAM-RUN-003",
    "GAAM-RUN-004",
    "GAAM-RUN-005",
    "GAAM-RUN-006",
    "GAAM-RUN-007",
    "GAAM-RUN-008",
    "GAAM-RUN-009",
    "GAAM-LIFE-001",
    "GAAM-LIFE-002",
    "GAAM-LIFE-003",
    "GAAM-LIFE-004",
    "GAAM-LIFE-005",
    "GAAM-DEC-004",
    "GAAM-SAFE-001",
    "GAAM-SAFE-002",
    "GAAM-SAFE-003"
  ],
  "requiredArtifacts": [
    "conformance-claim",
    "validation-report"
  ],
  "requiredEvidence": [
    "requirement-traceability",
    "test-results"
  ],
  "requiredTests": [
    "profile-completeness",
    "dependency-closure",
    "schema-validation"
  ],
  "permittedExclusions": [],
  "dependencies": [
    "gaam:profile:foundation:0.9.0"
  ]
}
